{
  "system_id": "gamma_rainfall",
  "domain": "diffusion",
  "name": "站点时段降雨量（水文）",
  "family": "gamma",
  "equations": {
    "latex": "p(x) = x^{k-1} e^{-x/\\theta} / (\\Gamma(k)\\theta^k)",
    "sympy": "p = x**(k-1)*exp(-x/theta)/(gamma(k)*theta**k)"
  },
  "parameters": [
    {
      "name": "k",
      "symbol": "k",
      "range": [
        0.5,
        10.0
      ],
      "default": 0.9
    },
    {
      "name": "theta",
      "symbol": "\\theta",
      "range": [
        0.1,
        5.0
      ],
      "default": 2.0
    }
  ],
  "channel_template": "CT-GAMMA-001",
  "fingerprint_expectation": [
    {
      "quantity": "fisher_trace",
      "analytic": "polygamma(1, k) + k/theta^2",
      "tol": 1e-06
    },
    {
      "quantity": "fisher_det",
      "analytic": "(k*polygamma(1, k) - 1)/theta^2",
      "tol": 1e-06
    }
  ],
  "strictness_level": "定理",
  "source_ref": "标准水文统计（伽马雨量拟合）",
  "scan_param": "k",
  "provenance": {
    "source": "AI+verified",
    "generator_model": "batch-generator-v1 (programmatic template fill)",
    "verified_by": "analytic_compare",
    "human_review_status": "spot_checked",
    "review_date": "2026-10-02",
    "reviewers": [
      "user"
    ]
  },
  "convention_version": "1.0.0"
}