{
  "system_id": "landau_b2_kt1",
  "domain": "thermodynamics",
  "name": "强非线性近临界（b=2）",
  "family": "landau",
  "equations": {
    "latex": "F = \\tfrac12 a \\phi^2 + \\tfrac14 b \\phi^4",
    "sympy": "F = a*phi**2/2 + b*phi**4/4"
  },
  "parameters": [
    {
      "name": "a",
      "symbol": "a",
      "range": [
        -2.0,
        2.0
      ],
      "default": -0.5
    },
    {
      "name": "b",
      "symbol": "b",
      "range": [
        0.1,
        5.0
      ],
      "default": 2.0
    },
    {
      "name": "kT",
      "symbol": "k_B T",
      "range": [
        0.1,
        5.0
      ],
      "default": 1.0,
      "unit": "energy",
      "is_bridge_constant": true
    }
  ],
  "channel_template": "CT-LANDAU-001",
  "fingerprint_expectation": [],
  "strictness_level": "定理",
  "source_ref": "Landau 相变理论（序参量涨落）",
  "scan_param": "a",
  "provenance": {
    "source": "AI+verified",
    "generator_model": "batch-generator-v1 (programmatic template fill)",
    "verified_by": "analytic_compare",
    "human_review_status": "pending",
    "review_date": null
  },
  "convention_version": "1.0.0"
}