{
  "system_id": "count_dark_rate",
  "domain": "quantum",
  "name": "暗计数本底（极低计数率）",
  "family": "poisson_count",
  "equations": {
    "latex": "P(n) = \\frac{\\lambda^n e^{-\\lambda}}{n!}",
    "sympy": "P = rate**n*exp(-rate)/factorial(n)"
  },
  "parameters": [
    {
      "name": "rate",
      "symbol": "\\lambda",
      "range": [
        0.1,
        20.0
      ],
      "default": 0.2
    }
  ],
  "channel_template": "CT-COUNT-001",
  "fingerprint_expectation": [
    {
      "quantity": "fisher_trace",
      "analytic": "1/rate",
      "tol": 1e-06
    },
    {
      "quantity": "fisher_det",
      "analytic": "1/rate",
      "tol": 1e-06
    }
  ],
  "strictness_level": "定理",
  "source_ref": "标准统计（泊松计数过程）",
  "scan_param": "rate",
  "provenance": {
    "source": "AI+verified",
    "generator_model": "batch-generator-v1 (programmatic template fill)",
    "verified_by": "analytic_compare",
    "human_review_status": "pending",
    "review_date": null
  },
  "convention_version": "1.0.0"
}