{
  "system_id": "chisq_whitened_residual",
  "domain": "signal",
  "name": "白化残差能量（k 维最小二乘）",
  "family": "chisq",
  "equations": {
    "latex": "p(x) = x^{k/2-1} e^{-x/2} / (2^{k/2} \\Gamma(k/2))",
    "sympy": "p = x**(k/2-1)*exp(-x/2)/(2**(k/2)*gamma(k/2))"
  },
  "parameters": [
    {
      "name": "k",
      "symbol": "k",
      "range": [
        1.0,
        20.0
      ],
      "default": 4.0
    }
  ],
  "channel_template": "CT-CHISQ-001",
  "fingerprint_expectation": [
    {
      "quantity": "fisher_trace",
      "analytic": "polygamma(1, k/2)/4",
      "tol": 1e-06
    },
    {
      "quantity": "fisher_det",
      "analytic": "polygamma(1, k/2)/4",
      "tol": 1e-06
    }
  ],
  "strictness_level": "定理",
  "source_ref": "标准统计（卡方分布）",
  "scan_param": "k",
  "provenance": {
    "source": "AI+verified",
    "generator_model": "batch-generator-v1 (programmatic template fill)",
    "verified_by": "analytic_compare",
    "human_review_status": "spot_checked",
    "review_date": "2026-10-02",
    "reviewers": [
      "user"
    ]
  },
  "convention_version": "1.0.0"
}