{
  "system_id": "elastic_crystal_bond",
  "domain": "materials",
  "name": "晶体键合刚度（低温）",
  "family": "elastic",
  "equations": {
    "latex": "U = \\tfrac12 k x^2",
    "sympy": "U = k*x**2/2"
  },
  "parameters": [
    {
      "name": "k",
      "symbol": "k",
      "range": [
        0.1,
        10.0
      ],
      "default": 0.3
    },
    {
      "name": "kT",
      "symbol": "k_B T",
      "range": [
        0.1,
        5.0
      ],
      "default": 2.0,
      "unit": "energy",
      "is_bridge_constant": true
    }
  ],
  "channel_template": "CT-MECH-001",
  "fingerprint_expectation": [
    {
      "quantity": "fisher_trace",
      "analytic": "3*k/kT",
      "tol": 1e-06
    },
    {
      "quantity": "fisher_det",
      "analytic": "2*k^2/kT^2",
      "tol": 1e-06
    }
  ],
  "strictness_level": "定理",
  "source_ref": "Landau & Lifshitz, Ch.12",
  "scan_param": "k",
  "provenance": {
    "source": "AI+verified",
    "generator_model": "batch-generator-v1 (programmatic template fill)",
    "verified_by": "analytic_compare",
    "human_review_status": "pending",
    "review_date": null
  },
  "convention_version": "1.0.0"
}