{
  "system_id": "beta_occupancy_fraction",
  "domain": "materials",
  "name": "固溶体 B 位占据分数涨落",
  "family": "beta",
  "equations": {
    "latex": "p(x) = x^{\\alpha-1}(1-x)^{\\beta-1}/B(\\alpha,\\beta)",
    "sympy": "p = x**(alpha-1)*(1-x)**(beta-1)/beta_func(alpha, beta)"
  },
  "parameters": [
    {
      "name": "alpha",
      "symbol": "\\alpha",
      "range": [
        0.5,
        5.0
      ],
      "default": 2.0
    },
    {
      "name": "beta",
      "symbol": "\\beta",
      "range": [
        0.5,
        5.0
      ],
      "default": 3.0
    }
  ],
  "channel_template": "CT-BETA-001",
  "fingerprint_expectation": [
    {
      "quantity": "fisher_trace",
      "analytic": "polygamma(1, alpha) + polygamma(1, beta) - 2*polygamma(1, alpha + beta)",
      "tol": 1e-06
    },
    {
      "quantity": "fisher_det",
      "analytic": "polygamma(1, alpha)*polygamma(1, beta) - polygamma(1, alpha + beta)*(polygamma(1, alpha) + polygamma(1, beta))",
      "tol": 1e-06
    }
  ],
  "strictness_level": "定理",
  "source_ref": "标准合金统计（占据涨落）",
  "scan_param": "alpha",
  "provenance": {
    "source": "AI+verified",
    "generator_model": "batch-generator-v1 (programmatic template fill)",
    "verified_by": "analytic_compare",
    "human_review_status": "spot_checked",
    "review_date": "2026-09-27",
    "reviewers": [
      "user"
    ]
  },
  "convention_version": "1.0.0"
}