{
  "system_id": "negbin_k3_moderate",
  "domain": "signal",
  "name": "k=3 中度超散",
  "family": "negbin",
  "equations": {
    "latex": "P(n) = \\binom{n-1}{k-1} p^k (1-p)^{n-k}",
    "sympy": "P = binomial(n-1, k-1)*p**k*(1-p)**(n-k)"
  },
  "parameters": [
    {
      "name": "k",
      "symbol": "k",
      "range": [
        1.0,
        10.0
      ],
      "default": 3.0
    },
    {
      "name": "p",
      "symbol": "p",
      "range": [
        0.05,
        0.5
      ],
      "default": 0.15
    }
  ],
  "channel_template": "CT-NEGBIN-001",
  "fingerprint_expectation": [
    {
      "quantity": "fisher_trace",
      "analytic": "k/(p**2*(1-p))",
      "tol": 1e-06
    },
    {
      "quantity": "fisher_det",
      "analytic": "k/(p**2*(1-p))",
      "tol": 1e-06
    }
  ],
  "strictness_level": "定理",
  "source_ref": "标准统计（负二项分布）",
  "scan_param": "p",
  "provenance": {
    "source": "AI+verified",
    "generator_model": "batch-generator-v1 (programmatic template fill)",
    "verified_by": "analytic_compare",
    "human_review_status": "spot_checked",
    "review_date": "2026-10-02",
    "reviewers": [
      "user"
    ]
  },
  "convention_version": "1.0.0"
}