{
  "system_id": "beta_j_shaped",
  "domain": "materials",
  "name": "J 形分布（α<1<β）",
  "family": "beta",
  "equations": {
    "latex": "p(x) = x^{\\alpha-1}(1-x)^{\\beta-1}/B(\\alpha,\\beta)",
    "sympy": "p = x**(alpha-1)*(1-x)**(beta-1)/beta_func(alpha, beta)"
  },
  "parameters": [
    {
      "name": "alpha",
      "symbol": "\\alpha",
      "range": [
        0.5,
        5.0
      ],
      "default": 0.7
    },
    {
      "name": "beta",
      "symbol": "\\beta",
      "range": [
        0.5,
        5.0
      ],
      "default": 4.0
    }
  ],
  "channel_template": "CT-BETA-001",
  "fingerprint_expectation": [
    {
      "quantity": "fisher_trace",
      "analytic": "polygamma(1, alpha) + polygamma(1, beta) - 2*polygamma(1, alpha + beta)",
      "tol": 1e-06
    },
    {
      "quantity": "fisher_det",
      "analytic": "polygamma(1, alpha)*polygamma(1, beta) - polygamma(1, alpha + beta)*(polygamma(1, alpha) + polygamma(1, beta))",
      "tol": 1e-06
    }
  ],
  "strictness_level": "定理",
  "source_ref": "标准贝塔分布统计",
  "scan_param": "alpha",
  "provenance": {
    "source": "AI+verified",
    "generator_model": "batch-generator-v1 (programmatic template fill)",
    "verified_by": "analytic_compare",
    "human_review_status": "pending",
    "review_date": null
  },
  "convention_version": "1.0.0"
}